{
  "schema_version": 1,
  "game": "RO 仙境传说 3 / Ragnarok Online 3",
  "last_reviewed": "2026-07-28",
  "sources": [
    {
      "id": "official-global-site-2026",
      "kind": "official_site",
      "grade": "A",
      "status": "reviewed",
      "title": "RO仙境传说 3 全球官方网站",
      "url": "https://ro3global.com/zh-TW/",
      "tags": ["identity", "ignition_test", "classes"]
    },
    {
      "id": "official-cn-pv-bv1fmkh63ept",
      "kind": "official_video",
      "grade": "A",
      "status": "reviewed_with_frames",
      "title": "RO正统续作《仙境传说3》首曝PV&实机演示",
      "url": "https://www.bilibili.com/video/BV1fmKH63EPT/",
      "tags": ["cn_release", "gameplay", "ui", "combat"]
    },
    {
      "id": "official-producer-letter-taptap",
      "kind": "official_post",
      "grade": "A",
      "status": "reviewed",
      "title": "RO3制作人的信：以初心赴新程",
      "url": "https://www.taptap.cn/moment/828606077506422297?group_id=1309844",
      "tags": ["cn_release", "design_intent", "august_test"]
    },
    {
      "id": "official-jp-service-announcement",
      "kind": "official_post",
      "grade": "A",
      "status": "reviewed",
      "title": "GungHo 日本地区服务提供决定公告",
      "url": "https://www.gungho.co.jp/jp/news/ccjg5s00000000wh.html",
      "tags": ["platforms", "publisher"]
    },
    {
      "id": "tw-ignition-recruitment",
      "kind": "official_repost",
      "grade": "A",
      "status": "reviewed",
      "title": "启燃测试开放报名与测试说明",
      "url": "https://forum.gamer.com.tw/C.php?bsn=81475&snA=41",
      "tags": ["test_window", "pc", "technical_test"]
    },
    {
      "id": "cn-first-test-announcement",
      "kind": "media_report",
      "grade": "C",
      "status": "reviewed",
      "title": "国服 2026-08-27 限量删档首测，仅限 PC",
      "url": "https://www.ithome.com/0/979/565.htm",
      "tags": ["cn_release", "august_test", "pc"]
    },
    {
      "id": "day1-guide-bv1yqtk6oekk",
      "kind": "test_video",
      "grade": "B",
      "status": "reviewed_with_frames",
      "title": "RO仙境传说3 开服第1天：职业、宠物、生活职业、每日必做",
      "url": "https://www.bilibili.com/video/BV1YqTK6oEkk/",
      "primary_url": "https://www.youtube.com/watch?v=SNpXR5F2UXc",
      "primary_author": "阿翊",
      "published_at": "2026-06-25T15:22:20+08:00",
      "tags": ["controls", "settings", "auto_battle", "daily", "life", "stall", "farming"]
    },
    {
      "id": "day1-guide-written",
      "kind": "test_article",
      "grade": "B",
      "status": "reviewed",
      "title": "RO仙境传说3 开服第1天完整解析",
      "url": "https://home.gamer.com.tw/artwork.php?sn=6355828",
      "tags": ["daily", "stall", "farming", "limits"]
    },
    {
      "id": "life-mining-bv18h756kehz",
      "kind": "test_video",
      "grade": "B",
      "status": "reviewed_with_frames",
      "title": "RO 仙境传说 3 启燃测试实机试玩：生活职业与采矿",
      "url": "https://www.bilibili.com/video/BV18H756KEhz/",
      "primary_url": "https://www.youtube.com/watch?v=1S8-6dr2lN4",
      "primary_author": "巴哈姆特电玩疯",
      "published_at": "2026-06-26T19:13:21+08:00",
      "duration_seconds": 1348,
      "tags": ["life", "vitality", "recipe", "potion", "mining", "gathering"]
    },
    {
      "id": "week-review-bv1okni6kezy",
      "kind": "test_video",
      "grade": "B",
      "status": "transcribed_and_reviewed",
      "title": "仙境传说RO3启燃测试的一周体验",
      "url": "https://www.bilibili.com/video/BV1oKNi6kEzy/",
      "tags": ["daily", "farming", "collection", "life", "pets", "economy"]
    },
    {
      "id": "bahamut-ignition-long-feedback-189",
      "kind": "test_article",
      "grade": "B",
      "status": "reviewed",
      "title": "启燃测试心得",
      "url": "https://forum.gamer.com.tw/Co.php?bsn=81475&sn=189",
      "tags": ["daily", "errands", "farming", "caravan", "life", "inventory", "cards"]
    },
    {
      "id": "bahamut-system-overview-187",
      "kind": "test_article",
      "grade": "B",
      "status": "reviewed",
      "title": "RO3 测试体验 Part 2 系统概观简评",
      "url": "https://forum.gamer.com.tw/Co.php?bsn=81475&sn=187",
      "tags": ["daily_loop", "farming", "fatigue", "pet_tower", "stall", "market"]
    },
    {
      "id": "bahamut-first-day-impression-115",
      "kind": "test_article",
      "grade": "B",
      "status": "reviewed",
      "title": "RO仙境传说3 首日体验",
      "url": "https://forum.gamer.com.tw/Co.php?bsn=81475&sn=115",
      "tags": ["controls", "auto_path", "auto_battle", "open_world"]
    },
    {
      "id": "day2-guide-4gamers",
      "kind": "test_article_video",
      "grade": "B",
      "status": "article_and_embedded_video_reviewed",
      "title": "开服第2天：45等、二转、精炼、嘉奖宝库",
      "url": "https://www.4gamers.com.tw/saged/detail/4xllo6pm0q7pp9",
      "video_url": "https://www.youtube.com/watch?v=HazCobJ2yU0",
      "tags": ["daily", "progression", "refine", "rift"]
    },
    {
      "id": "auto-farm-knight-bv1hgti6oera",
      "kind": "test_video",
      "grade": "B",
      "status": "continuous_timeline_reviewed_no_death",
      "title": "RO3 敏骑挂机螳螂",
      "url": "https://www.bilibili.com/video/BV1HgTi6oEra/",
      "primary_author": "单人旅团",
      "published_at": "2026-07-01T15:34:45+08:00",
      "duration_seconds": 165,
      "tags": ["farming", "combat_hud", "continuous_timeline_reviewed", "low_health_candidate", "video_ends_in_combat", "no_death_state"]
    },
    {
      "id": "farm-two-cards-bv1fkkd6ceyl",
      "kind": "test_video",
      "grade": "B",
      "status": "continuous_timeline_reviewed",
      "title": "6分钟挂出2张卡 骑士挂机效率感觉还行",
      "url": "https://www.bilibili.com/video/BV1FkKd6CEYL/",
      "published_at": "2026-06-30T10:08:52+08:00",
      "duration_seconds": 315,
      "tags": ["farming", "auto_battle", "card_drop", "reward_popup", "boost_panel"]
    },
    {
      "id": "full-class-run-bv1vhhizdeex",
      "kind": "test_video",
      "grade": "B",
      "status": "full_two_second_timeline_reviewed_old_build_exclusion_only",
      "title": "仙境传说MMO端游续作 内测游戏实录 RO3 全职业三转试玩+跑图",
      "url": "https://www.bilibili.com/video/BV1vhhizdEeX/",
      "primary_author": "云千影Sorcer",
      "published_at": "2025-08-30T21:39:42+08:00",
      "duration_seconds": 586,
      "tags": ["pioneer_build", "old_build", "movement", "hud", "world_map", "skills", "all_classes", "third_job", "full_timeline_reviewed", "no_target_exception", "excluded_from_test_b_templates", "no_evidence_saved"]
    },
    {
      "id": "gstar-mobile-demo-bv11vmdytesx",
      "kind": "test_video",
      "grade": "B",
      "status": "full_storyboard_reviewed_old_build_exclusion_only",
      "title": "GSTAR 2024 手机实机试玩",
      "url": "https://www.bilibili.com/video/BV11VmdYtESx/",
      "primary_url": "https://www.youtube.com/watch?v=DL7vf0YxsJQ",
      "primary_author": "껨조TV",
      "published_at": "2024-11-15T12:05:31+08:00",
      "duration_seconds": 721,
      "tags": ["mobile_ui", "controls", "early_build", "storyboard_reviewed", "no_target_ui_state", "excluded_scope"]
    },
    {
      "id": "producer-qa-bv1hpkg6qeda",
      "kind": "test_video",
      "grade": "B",
      "status": "full_two_second_timeline_reviewed_secondary_qa_no_target_state",
      "title": "《RO3》制作人直播都聊了什么？官方回应玩家提问",
      "url": "https://www.bilibili.com/video/BV1hpKG6qEda/",
      "primary_author": "波利搬运工",
      "published_at": "2026-07-16T18:20:17+08:00",
      "duration_seconds": 520,
      "tags": ["planned_changes", "daily_rework", "policy", "commentary", "secondary_edit", "full_timeline_reviewed", "no_target_ui_state", "no_evidence_saved"]
    },
    {
      "id": "test-critique-bv1qyt964ehc",
      "kind": "test_video",
      "grade": "B",
      "status": "transcribed_reviewed_with_frame",
      "title": "RO仙境传说3 测试版本批评与系统分析",
      "url": "https://www.bilibili.com/video/BV1QyT964EHc/",
      "published_at": "2026-07-06T19:39:56+08:00",
      "duration_seconds": 440,
      "tags": ["pain_points", "daily_burden", "economy", "life_professions"]
    },
    {
      "id": "monetization-summary-bv1mctl6cefh",
      "kind": "test_video",
      "grade": "B",
      "status": "transcribed_reviewed_low_confidence",
      "title": "RO3 职业、卡片、搬砖真实体验汇报",
      "url": "https://www.bilibili.com/video/BV1mCTL6CEfh/",
      "tags": ["cards", "farming", "trade", "inventory"]
    },
    {
      "id": "tgs-dev-impression-ptt",
      "kind": "hands_on_article",
      "grade": "B",
      "status": "reviewed",
      "title": "TGS RO3 开发版体验",
      "url": "https://www.pttweb.cc/bbs/C_Chat/M.1738923695.A.1F3",
      "tags": ["movement", "combat", "auto_battle"]
    },
    {
      "id": "gamebase-ignition-announcement",
      "kind": "media_report",
      "grade": "C",
      "status": "reviewed",
      "title": "启燃测试招募、多人数稳定性与 PC 自定义界面",
      "url": "https://news.gamebase.com.tw/news/detail/99440618",
      "tags": ["test_scope", "custom_ui", "pc"]
    },
    {
      "id": "cn-reunion-test-taptap-20260721",
      "kind": "official_post",
      "grade": "A",
      "status": "reviewed",
      "title": "RO正统续作《仙境传说3》重逢首测开启招募",
      "url": "https://www.taptap.cn/moment/828585152161515154",
      "published_at": "2026-07-21",
      "tags": ["cn_release", "august_test", "pc", "test_terms"]
    },
    {
      "id": "biligame-user-agreement-20260228",
      "kind": "terms",
      "grade": "A",
      "status": "reviewed",
      "title": "哔哩哔哩游戏中心用户协议",
      "url": "https://yhxy.biligame.com/",
      "effective_at": "2026-02-28",
      "tags": ["cn", "compliance", "simulated_input", "third_party_software"]
    },
    {
      "id": "ro3-global-tos-20260605",
      "kind": "terms",
      "grade": "A",
      "status": "reviewed",
      "title": "Terms of Service - Ragnarok Online 3",
      "url": "https://joymaker.com/protocol/ro3/terms-of-service.html",
      "effective_at": "2026-06-05",
      "tags": ["global", "compliance", "auto", "macro", "china_excluded"]
    },
    {
      "id": "gravity-2026q1-form6k",
      "kind": "regulatory_filing",
      "grade": "A",
      "status": "reviewed",